{
  "$schema": "../schemas/antenna-config.schema.json",
  "schema_version": 2,
  "id": "quados8_1420mhz_initial",
  "model_status": "unvalidated",
  "antenna": {
    "model": "quados8",
    "parameter_schema": "../schemas/quados8-parameters.schema.json",
    "parameters": {
      "sections": 8,
      "dimensions_m": {
        "A": 0.0339894366197183,
        "B": 0.06935915492957748,
        "C": 0.07125704225352113,
        "D": 0.07643309859154929,
        "E": 0.06470070422535211,
        "F": 0.07177464788732393,
        "G": 0.01966901408450704,
        "H": 0.02363732394366197,
        "wire_diameter": 0.0034507042253521126,
        "reflector_length": 1.2422535211267605,
        "reflector_width": 0.12595070422535212,
        "reflector_thickness": 0.0025880281690140844
      }
    }
  },
  "simulation": {
    "frequency_hz": [
      1420000000.0
    ],
    "medium": "vacuum",
    "conductor_model": "PEC",
    "reflector_model": "pec_plate",
    "feed_model": "differential_lumped_port",
    "reference_impedance_ohm": 200.0,
    "accepted_power_w": 1.0,
    "phasor_convention": "real(F * exp(+j * phase))"
  },
  "requested_outputs": {
    "currents": false,
    "impedance": true,
    "far_field": true,
    "field_planes": [],
    "phase_degrees": [
      0,
      30,
      60,
      90,
      120,
      150,
      180
    ],
    "full_period_animation": false
  },
  "provenance": {
    "source_file": "reference/quados8_yu1aw.json",
    "scaling_reference_frequency_hz": 2450000000.0,
    "scaling_target_frequency_hz": 1420000000.0,
    "scale_factor": 1.7253521126760563,
    "reference_frequency_status": "assumed_not_verified",
    "scaling_mode": "all_physical_dimensions",
    "note": "Initial geometric scaling, not a tuned or validated antenna. Changing frequency does not automatically change geometry."
  },
  "solver": {
    "name": "openEMS",
    "cells_per_wire_diameter": 3,
    "cells_per_wavelength": 20,
    "growth_ratio": 1.4,
    "padding_wavelengths": 0.5,
    "pml_cells": 8,
    "max_cells": 25000000,
    "max_timesteps": 200000,
    "end_criteria": 1e-05,
    "threads": 0,
    "excitation_fractional_bandwidth": 0.2,
    "far_field_step_deg": 5
  }
}
